{
  "$schema": "https://json-schema.org/draft/2020-12/schema",
  "$id": "xdebug.session.open.response.v1",
  "title": "session.open response",
  "type": "object",
  "required": [
    "api_version",
    "ok",
    "action",
    "summary",
    "data"
  ],
  "properties": {
    "api_version": {
      "type": "string",
      "enum": [
        "xdebug.v1"
      ]
    },
    "request_id": {
      "type": "string"
    },
    "ok": {
      "type": "boolean"
    },
    "action": {
      "type": "string",
      "enum": [
        "session.open"
      ]
    },
    "summary": {
      "type": "object",
      "additionalProperties": true
    },
    "data": {
      "type": "object"
    },
    "findings": {
      "type": "array"
    },
    "warnings": {
      "type": "array"
    },
    "error": {},
    "meta": {
      "type": "object"
    }
  },
  "additionalProperties": true
}
