{
  "api_version": "xdebug.v1",
  "ok": true,
  "action": "session.open",
  "summary": {
    "session_id": "case_a",
    "mode": "combined"
  },
  "data": {
    "session": {
      "id": "case_a",
      "mode": "combined",
      "daidir": "simv.daidir",
      "fsdb": "waves.fsdb"
    }
  },
  "warnings": []
}
